{
  "$schema": "https://json-schema.org/draft/2020-12/schema",
  "title": "Brief",
  "type": "object",
  "required": [
    "schema_version",
    "task_id",
    "objective",
    "in_scope",
    "out_of_scope",
    "constraints",
    "acceptance_criteria",
    "risk_level"
  ],
  "properties": {
    "schema_version": {
      "type": "string",
      "const": "0.2"
    },
    "task_id": {
      "type": "string"
    },
    "objective": {
      "type": "string"
    },
    "in_scope": {
      "type": "array",
      "items": {
        "type": "string"
      }
    },
    "out_of_scope": {
      "type": "array",
      "items": {
        "type": "string"
      }
    },
    "constraints": {
      "type": "array",
      "items": {
        "type": "string"
      }
    },
    "acceptance_criteria": {
      "type": "array",
      "items": {
        "type": "string"
      }
    },
    "risk_level": {
      "enum": [
        "low",
        "medium",
        "high"
      ]
    },
    "route": {
      "type": "string",
      "enum": [
        "small",
        "medium",
        "high"
      ]
    },
    "assumptions": {
      "type": "array",
      "items": {
        "type": "string"
      }
    },
    "open_questions": {
      "type": "array",
      "items": {
        "type": "string"
      }
    },
    "use_worktree": {
      "type": "boolean",
      "description": "Whether to create a git worktree for isolated execution. If not set, the agent should ask the user at execute stage."
    },
    "required_specialists": {
      "type": "array",
      "items": {
        "type": "string",
        "enum": [
          "security-review",
          "ux-review",
          "perf-review",
          "frontend-execute",
          "backend-execute",
          "infra-execute"
        ]
      },
      "description": "Specialist agents activated on-demand by the clarify stage based on task nature."
    },
    "skipped_specialists": {
      "type": "array",
      "items": {
        "type": "string",
        "enum": [
          "security-review",
          "ux-review",
          "perf-review",
          "frontend-execute",
          "backend-execute",
          "infra-execute"
        ]
      },
      "description": "Specialist agents explicitly skipped with rationale."
    },
    "skip_rationale": {
      "type": "string",
      "description": "Why skipped specialists are not needed for this task."
    }
  },
  "additionalProperties": false
}
