{
  "schema_version": "0.2",
  "task_id": "task-large-unsafe-001",
  "objective": "Run a large high-risk route fixture",
  "in_scope": [
    "runtime",
    "docs"
  ],
  "out_of_scope": [
    "live deployment"
  ],
  "constraints": [
    "local fixture only"
  ],
  "acceptance_criteria": [
    "large route completes including long-run"
  ],
  "risk_level": "high"
}
